"A symmetry between reader and writer: A conversational, informal style. A determination to be visual and concrete. An excitement about showing the reader something in the world that the reader can see for themselves, rather than concentrating on the activity of the people who have studied that thing",,,,,,,,,,,,,,
"The point isn’t to learn to fail, it is to learn to bounce back",,,,,,,,,,,,,,
"Life asserts itself against all imposed limits, yet quickly dies when deprived of structure.",,,,,,,,,,,,,,
"The anxiety that we all tell upon recognizing our own finitude provokes us to deny that finitude and magnify our freedom. That attempt to become the source of our own security epitomizes what Christians have called ""sin,"" turning away from the true God to other gods of our own making",,,,,,,,,,,,,,
"What goals do is they focus us. They focus us on where we want to go. Being focused on a task produces organization and efficiency, both within the organism and in the environment. They act as self-fulfilling proochecies. Necessity is the mother of inventions: if you threw your bagpack over the brickwall, you have to overcome it! Either by breaking it, by climbing it or by asking for help. But once you threw it over the wall, you're much more likely to get over it. When we make the commitment, we are much more liekely to do it. Why? Because the mind doesn't like when there's inconsistency between what is outside in the real world and what is inside our minds. Our words create worlds. What we say we'll do, what we commit to very often creates the reality. Remember: countries were declared into existence by words",,,,,,,,,,,,,,
We first make our habits and then our habits make us,,,,,,,,,,,,,,
It's really funny how you get used to things way easier if you set your mind for doing so,,,,,,,,,,,,,,
"Eye contact and verbal contact reflect concern and individuation; their absence, avoidance anddepersonalization",,,,,,,,,,,,,,
Normality and abnormality are not universal,,,,,,,,,,,,,,
"I believe that nothing is unconditionally true, and hence I am opposed to every statement of positive truth and every man who makes it. -H.L. Mencken",,,,,,,,,,,,,,
"Substitute for data any term you wish: subject, people, ideas.Fuzzy sets are sets whose elements have degrees of membership.In fuzzy clustering (also referred to as soft clustering), data elements can belong to more than one cluster, and associated with each element is a set of membership levels. These indicate the strength of the association between that data element and a particular cluster. The degree of belonging, is related inversely to the distance from x to the cluster center. This algorithm (i.e. method) minimizes intra-cluster variance.Clustering is the process of dividing data elements into classes or clusters so that items in the same class are as similar as possible, and items in different classes are as dissimilar as possible. Depending on the nature of the data and the purpose for which clustering is being used, different measures of similarity may be used to place items into classes, where the similarity measure controls how the clusters are formed. Some examples of measures that can be used as in clustering include distance, connectivity, and intensity",,,,,,,,,,,,,,
"Some things in life cannot be fixed. They can only be carried.Our culture treats grief like a problem to be solved or an illness to be healed. We’ve done everything we can to avoid, ignore, or transform grief. So that now, when you’re faced with tragedy, you usually find that you’re no longer surrounded by people — you’re surrounded by platitudes",,,,,,,,,,,,,,
You can't stop the waves but you can learn how to surf,,,,,,,,,,,,,,
Nicht was man schön findet liebt man. Sondern was man liebt findet man schön,,,,,,,,,,,,,,
"Liebe hat keine Haltbarkeit, sie ist jeden Tag Frischware",,,,,,,,,,,,,,
"All too often, however, we fail to pursue a dream because we are compromising a long-term need with a short-term want.",,,,,,,,,,,,,,
"You never change things by fighting the existing reality. To change something, build a new model that makes the existing model obsolete",,,,,,,,,,,,,,
Stop searching for unanswered questions and look for unquestioned answers,,,,,,,,,,,,,,
"Reality is a necessary hypothesis without which we cannot function.We live our social, political and economic lives,indeed our physical existence, as if there is a real world out there and, whilst we may beable to reflect upon the contingent nature of this reality, cannot do otherwise.",,,,,,,,,,,,,,
"As an individual in this world I am torn in between:The means with which the happy person is fighting for its objective is to maintain balance and harmony from directing the mind to a state of constant equilibrium. The means of the meaningful person to fight its way is to continuously remain in a state of disequilibrium of assumptions, to constantly question and never to settle.How could one possibly not conceive the two virtues resting on one and the same continuum? And what should one try to find? Peace of mind or turmoil of mind?",,,,,,,,,,,,,,
"Upon this first, and in one sense this sole, rule of reason, that in order to learn you must desire to learn, and in so desiring not be satisfied with what you already incline to think, there follows one corollary which itself deserves to be inscribed upon every wall of the city of philosophy: Do not block the way of inquiry.",,,,,,,,,,,,,,
"Concerning all acts of creation there is one elementary truth, the ignorance of which kills countless ideas and splendid plans: That the moment one definitely commits oneself, then providence moves too. All sorts of things occur to help one that would not have otherwise occured. A whole stream of events issues from the decision, raising in one's favor all manner of unforeseen incidents and meetings and material assistance which no man would have dreamed would come his way. Whatever you can do, or dream you can, begin it! Boldness has genius, magic, and power in it. When you commit, things begin to happen!",,,,,,,,,,,,,,
"Analogies reveal hidden essences of some kind.Analogies reveal underlyingaffinities of structures, functions, or essences, and as such theypoint to long chains of objects that all somehow relate to each other",,,,,,,,,,,,,,
Recognize your limits and expose your self-understanding,,,,,,,,,,,,,,
"The enemy of science is not religion. The true enemy is the substitution of thought, reflection, and curiosity with dogma.",,,,,,,,,,,,,,
Attribution structures the space of imaginative possibilities,,,,,,,,,,,,,,
"Frage nicht, wo du am meisten lernst oder das nützlichste an Wissen bekommst. Frage nicht, wohin dich dieses Wissen bringen kann und wohin nicht. Überlege genau, wer festlegen soll, wo dein Wissenserwerb, in welcher Form und mit welcher Motivation stattfinden soll. Frage zu allererst und zu allerletzt: wo lerne ich das, was mir wirklich wichtig ist am besten, am sinnvollsten und am nachhaltigsten?",,,,,,,,,,,,,,
"NVC means love, truth and courage",,,,,,,,,,,,,,
"The mind isn't good at recognizing the concept of ""not"". Its use can inadvertently reinforce the behavior you are seeking to change.",,,,,,,,,,,,,,
"""Tendemos a olvidar que la felicidad no viene como resultado de obtener algo que no tenemos, sino de reconocer y apreciar lo que tenemos"".",,,,,,,,,,,,,,
"Reclaim autonomyIn today’s society, don’t forget to once in a while regain control over the vital aspects of your life. Decide for yourself how much time of your life you want to devote to work; what perspective you personally want to have on relationships, sexuality and how much thought and energy you want spend on worrying about what others might think. Once in a while, pick up again the steering wheel that, without you noticing it, seemed to steer itself; or was steered by surrogate wishes of money and its illusionary possibilities, by a longing for being accepted and a desperate struggle to make up your worth by looks. (von mir)",,,,,,,,,,,,,,
Constructing a personal history means asking what went wrong and how I can make it better in the future,,,,,,,,,,,,,,
"You can't feel the heat until you hold your hand over the flameYou have to cross the line just to remember where it laysYou won't know your worth now, son, until you take a hitAnd you won't find the beat until you lose yourself in itYou can't fill your cup until you empty all it hasYou can't understand what lays aheadIf you don't understand the pastYou'll never learn to fly now'Til you're standing at the cliffAnd you can't truly love until you've given up on it",,,,,,,,,,,,,,
"Es gibt kein Theorem, keinen Beweis, keine Leistung des Verstandes, die ein Problem lösen könnte,das durch den Verstand selbst erst entstanden ist.",,,,,,,,,,,,,,
Vorlesungen machen den Verstand träge. Sie zerstören das Potenzial für authentische Kreativität,,,,,,,,,,,,,,
"Der Mensch ist in dem Maße zu Gräueltaten fähig, wie es seine Phantasie zulässt",,,,,,,,,,,,,,
"Von a beautiful mind:Ich habe immer an Zahlen geglaubt - an die Gleichungen,die Gesetze der Logik, die zur Vernunft führten.Aber nach lebenslangen Bestrebungen dieser Art frage ich,was ist die Logik in Wahrheit?Wer entscheidet was Vernunft ist?Meine Suche führte mich durch das Physische, dasMetaphysische, das Wahnhafte und wieder zurück!Und ich habe die wichtigste Enddeckungmeiner Karriere gemacht.Die wichtigste Enddeckung meines Lebens!Nur in den rätselhaften Gleichungen der Liebe kannman irgendwelche logischen Gründe finden!",,,,,,,,,,,,,,
"Wer entscheidet, was Vernunft ist?",,,,,,,,,,,,,,
"Like in all forms of scientific understanding, the wish is father to the thought",,,,,,,,,,,,,,
"Have higher expectations if you want improvement, and lower expectations if you want contentment",,,,,,,,,,,,,,
"Perception in all phases of life is an activity. As you walk down the street, you scan your surroundings for salient aspects ­ a friend's face, a familiar landmark, a sign of rain. The mind is never at rest. It is constantly seeking order and significance, testing the world for breaks in the habitual pattern.Artworks rely on this dynamic, unifying quality of the human mind. They provide organized occasions in which we exercise and develop our ability to pay attention, to anticipate upcoming events, to draw conclusions, and to construct a whole out of parts. Every novel leaves something to the imagination; every song asks us to expect a certain melody; every film coaxes us to connect sequences into a larger whole",,,,,,,,,,,,,,
The human mind craves form,,,,,,,,,,,,,,
"Uns hatten Lichter geblendet, als wir im Dunkel standenWir waren durstig im Regen, als uns die Welt verbrauchte. Wir hatten Tickets gelöstvom hier ins Nirgendwo. Und, dass die Zukunft nicht wartet, sondern irgendwann eintritt hatten wir doch gewusst, also weint nicht.Die Zeit holt uns ein wenn wir uns nicht beeilen.",,,,,,,,,,,,,,
Structural changes begins in a system's unit,,,,,,,,,,,,,,
Mit Dogmatismus lässt sich nicht diskutieren,,,,,,,,,,,,,,
Sometimes difference of degree becomes difference of kind,,,,,,,,,,,,,,
Funktion bestimmt Form/ Form follows function. Thus:from the form you'll be able to infer the function,,,,,,,,,,,,,,
My experience is where I'm from,,,,,,,,,,,,,,
"We are what we repeatedly do. Excellence, therefore, is not an act but a habit",,,,,,,,,,,,,,
Das Genie schafft Natur in der Natur (Nietzsche),,,,,,,,,,,,,,
The mind doesn't differentiate between the imaginary thing and the real thing,,,,,,,,,,,,,,
"It's very rare that people enjoy lasting change if they don't follow up their attitudinal change, the realization, the understanding with action",,,,,,,,,,,,,,
Change almost inevitably means exiting our comfort zone. We have to pay attention though to find our own optimal level of discomfort.,,,,,,,,,,,,,,
The best way to complain is to make things. James Murphy,,,,,,,,,,,,,,
"Vermissen, wenn auch manchmal ein unangenehmes Gefühl, ist Ausdruck einer der positivsten Aspekte menschlicher Existenz: Vermissen ist Ausdruck tiefer Wertschätzung, die man für eine andere Seele empfindet.",,,,,,,,,,,,,,
"""The best moments in reading are when you come across something – a thought, a feeling, a way of looking at things – that you’d thought special, particular to you. And here it is, set down by someone else, a person you’ve never met, maybe even someone long dead. And it’s as if a hand has come out, and taken yours"".",,,,,,,,,,,,,,
"What we achieve inwardly, will change outer reality",,,,,,,,,,,,,,
Failure means stripping away of the inessential,,,,,,,,,,,,,,
"Ultimately, we'll have to decide for ourselves what constitutes failure",,,,,,,,,,,,,,
We have to be children when it comes to love.,,,,,,,,,,,,,,
"Relationships thrive on communication. Our most intimate emotions are reserved for the person we love, so how is it acceptable to never show them?",,,,,,,,,,,,,,
"We experience a lack of communication, attention, passion, intimacy and even lack of love. Why are we okay with this and all the communication shortcuts that have become so common?",,,,,,,,,,,,,,
Optimismus ist kein Selbstläufer.Resilienz ebenfalls.,,,,,,,,,,,,,,
"Not the ability to remember, but its very opposite, the power to forget is a necessary condition for our existence.",,,,,,,,,,,,,,
"Over the course of habituation, there is a shift from a familiarity preference to a novelty preference",,,,,,,,,,,,,,
"Sometimes those who have less, are the ones who give more.",,,,,,,,,,,,,,
"Skepticism is a resting-place for human reason, where it can reflect upon its dogmatic wanderings and make survey of the region in which it finds itself, so that for the future it may be able to choose its path with more certainty. But it is no dwelling-place for permanent settlement. Such can be obtained only through perfect certainty in our knowledge, alike of the objects themselves and of the limits within which all our knowledge of objects is enclosed.Simply to acquiesce in skepticism can never suffice to overcome the restlessness of reason.",,,,,,,,,,,,,,
"“You will never be completely at home again, because part of your heart always will be elsewhere. That is the price you pay for the richness of loving and knowing people in more than one place.”",,,,,,,,,,,,,,
"If you do something three times, write a script for it!",,,,,,,,,,,,,,
Institutions embody the ideas that created them.,,,,,,,,,,,,,,
Knowledge refers to an understanding of information that leads to it being used in a proper way or for a particular purpose,,,,,,,,,,,,,,
"Hate the game, not the players",,,,,,,,,,,,,,
You can't stop the waves but you can learn how to surf.,,,,,,,,,,,,,,
One very important aspect of motivation is the willingness to stop and look back at the things that no one else has bothered to look at. This simple process of focusing on things that are normally taken for granted is a powerful source of motivation.,,,,,,,,,,,,,,
Happiness is something you remember,,,,,,,,,,,,,,
How to adopt the eco-system attitude: 1) think and write about your values & priorities. 2) Articulate goals that relate to outcomes for other people. 3) Adopt an attitude of gratitude: where were/are my outcomes positively affected by others?,,,,,,,,,,,,,,
"The most powerful form of self-belief comes from believing in something greater than you. Because when you've got purpose, everything becomes possible.",,,,,,,,,,,,,,
To be yourself in a world that is constantly trying to make you something else is one of the greatest accomplishments.,,,,,,,,,,,,,,
Always do what you are afraid to do.,,,,,,,,,,,,,,
"Vergessen ist einfacher, als vergeben.",,,,,,,,,,,,,,
Was hemmt jetzt gerade in diesem Augenblick meine tiefste Leidenschaft?,,,,,,,,,,,,,,
"Glück ist, wenn was du denkst, was du sagst und was du tust im Einklang sind.",,,,,,,,,,,,,,
"In my early professional years I was asking the question: How can I treat, or cure, or change this person? Now I would phrase the question this way: How can I provide a relationship which this person may use for his/her own personal growth? (Carl Rogers)",,,,,,,,,,,,,,
The congruent character is strengthened through willpower and responsibility,,,,,,,,,,,,,,
Conformity is the jailer of freedom and the enemy of growth.,,,,,,,,,,,,,,
"Meine Realität entsteht ddurch meine Geschichte über ""was da draußen vor sich geht"". Und Geschichten sind erfunden. Unsere Gefühle halten unsere Geschichten immer für wahr.",,,,,,,,,,,,,,
One of the most striking characteristics of anxiety is the amount of time and energy it can take up.,,,,,,,,,,,,,,
Acceptance is the key to reducing anxiety and fears about being vulnerable.,,,,,,,,,,,,,,
Found love beyond a reason.,,,,,,,,,,,,,,
"Wenn ich Erwartungen Menschen gegenüber habe, gebe ich ihnen Macht. Ich mache mich abhängig von ihnen, mein Glück und Leid hängt jetzt zum Teil von ihnen ab. Ich drücke ihnen damit eine große Verwantwortung auf und das merken diese Menschen. Dazu kommt noch, dass ich sie nie gefragt habe, ob sie diese Verantwortung tragen wollen.",,,,,,,,,,,,,,
"The ultimate lesson all of us have to learn is unconditional love, which includes not only others but ourselves as well.",,,,,,,,,,,,,,
"No one is stronger than a man who knows and can harness his emotions, his past.",,,,,,,,,,,,,,
Obstacles as opportunities: what can I learn from this?,,,,,,,,,,,,,,
How to foster empathy: what do I have in common with another person?,,,,,,,,,,,,,,
Brick walls are there for a reason: they let us prove how badly we want something.,,,,,,,,,,,,,,
Character is higher than intellect. A great soul will be strong to live as well as think.,,,,,,,,,,,,,,
"What is most personal and unique in each one of us is probably the very element which would, if it were shared or expressed, speak most deeply to others",,,,,,,,,,,,,,
"Wir müssen uns damit abfinden, dass es möglich ist, etwas zu wissen, ohne genau sagen zu können, warum wir es wissen. Wir müssen akzeptieren, dass das manchmal auch besser so ist.",,,,,,,,,,,,,,
Between stimulus and response there is a space. In that space is our power to choose our response. In our response lies our growth and freedom,,,,,,,,,,,,,,
"What man actualy needs is not a tensionless state but rather the striving and struggling for a worthwhile goal, a freely chosen task.",,,,,,,,,,,,,,
"Wir tun viele Dinge nicht, weil man sie halt nicht tut.",,,,,,,,,,,,,,
"In actuality, no matter where you go, there you are, so the search for identity has no special place.",,,,,,,,,,,,,,
It's easy to be confident when no one has ever torn you down. It's harder when you have had reasons to be insecure and you're not.,,,,,,,,,,,,,,
"But there was no need to be ashamed of tears, for tears bore witness that a man had the greatest of courage, the courage to suffer",,,,,,,,,,,,,,
The objective approach to matters of personal truth cannot shed any light upon that which is most essential to a person's life.,,,,,,,,,,,,,,
Experience is what you get when you didn't get what you wanted,,,,,,,,,,,,,,
Without risk there is no trust.,,,,,,,,,,,,,,
Aim high but act as if you were the most precious being in the world when you fall low,,,,,,,,,,,,,,
It is not about providing definitive answers concerning the good life. It is about identifying the right questions.,,,,,,,,,,,,,,
Erfahrung entsteht beim Gehen von Umwegen.,,,,,,,,,,,,,,
"Negative Gefühle suggerieren, dass es immer so ist",,,,,,,,,,,,,,
There is nothing noble in being superior to your fellow man. True nobility is being superior to your former self. (Hemingway),,,,,,,,,,,,,,
Grabbing what you can get isn’t any less wicked when you grab it with the power of your brains than with the power of your fists.,,,,,,,,,,,,,,
"One of the great errors of an elite education, then, is that it teaches you to think that measures of intelligence and academic achievement aremeasures of value in some moral or metaphysical sense.",,,,,,,,,,,,,,
"I am a human, and I think nothing human is alien to me. (Terence)",,,,,,,,,,,,,,
Passivity in the face of unequal forces is anything but impartial,,,,,,,,,,,,,,
"Es geht im Leben nicht nur darum, wohin man geht, sondern wessen Weg man kreuzt!",,,,,,,,,,,,,,
"Schwächen sind, in Kontext gesetzt, das Ergebnis großer Stärken; denn stark ausgeprägte Stärken passen nicht zu jeder einzelnen Situation. (von Papa!)",,,,,,,,,,,,,,
"Virtue over knowledge, over success",,,,,,,,,,,,,,
A crisis is a reflection of an underlying contradiction.,,,,,,,,,,,,,,
Ask yourself: is this a unique instance or does it reflect a structural change?,,,,,,,,,,,,,,
"In an age of information, ignorance is your choice",,,,,,,,,,,,,,
"The social contract between the state and its citizen is national, but people's lives are not.",,,,,,,,,,,,,,
"„Wir fühlen, dass selbst, wenn alle möglichen wissenschaftlichen Fragen beantwortet sind, unsere Lebensprobleme noch gar nicht berührt sind.“ Ludwig Wittgenstein",,,,,,,,,,,,,,
"When I went to school, they asked me what I wanted to be when I grew up. I wrote down ‘happy.’ They told me I didn’t understand the assignment, and I told them they didn’t understand life.John Lennon",,,,,,,,,,,,,,
Intuition is reason in a hurry.,,,,,,,,,,,,,,
"Competence: Intelligence, personality, abilities, motivation",,,,,,,,,,,,,,
"Asking ""What do I want to achieve?"" is being goal-oriented.Asking ""What do I want to learn?"" is process-oriented.",,,,,,,,,,,,,,
"Wer wirklich an Wissen und an der Wahrheit interessiert ist, fällt häufiger die richtigen Entscheidungen und lässt sich nicht so leicht zu irgendwas verleiten.",,,,,,,,,,,,,,
"Jeremy's Definition von erfolgreichen Führungspersonen (=Intelligenz?): Probleme schnell, präzise und multi-perspektiv einschätzen. Pragmatische Lösungen entwerfen und diese verständlich und politisch sinnvoll kommunizieren",,,,,,,,,,,,,,
Honesty is the first chapter in the book of wisdom.Thomas Jefferson,,,,,,,,,,,,,,
"Many people think that their are two instances: the controller and the controlled. But biological systems aren't like that. The controller/controlled is always embedded in a system. One and the same mechanism can lead to different outcomes. A wheel on a robot may always simply roll, but the different material/surface etc. lead to different behaviors/outcomes",,,,,,,,,,,,,,
"Successful psychological functioning (Ryff, 1989):a) self-acceptance: feeling good about oneself and about one's past lifeb) positive relations with others: having high-quality, caring relationships with othersc) environmental mastery: being able to create an environment in which one can function successfullyd) autonomy: having the capacity to think and act on one's own, when appropriatee) purpose in life: having substantial reasons for livingf) personal growth: continuing to strive for personal improvement and development",,,,,,,,,,,,,,
If you always do what you always did – you will always get what you always got,,,,,,,,,,,,,,
Science is a pragmatic exploratory coping with the world,,,,,,,,,,,,,,
"Nichts ist im Intellekt, was nicht vorher in den Sinnen gewesen ist",,,,,,,,,,,,,,
Power is in combination,,,,,,,,,,,,,,
Ever tried. Ever failed. No matter. Try Again. Fail again. Fail better.,,,,,,,,,,,,,,
"Chasing love is not irresponsible, it’s honest. It’s admitting that there is no greater chase, nothing more important. Because if you’re not chasing love, what are you running after?",,,,,,,,,,,,,,
Why it is so incredibly important to be an effective learner. As opposed to thinking that after some time I have achieved the expertise to not have to be a learner anymore. Reason: in today's world you will have to work inter-disciplinary and thus you will always be a noob in a new field. Being a minority for a while!,,,,,,,,,,,,,,
We underestimate the capacity of systems to self-organize. Maybe that is why Rogers focused on providing simply the right condition. Maybe he trusted on the self-organizing capacity of humans,,,,,,,,,,,,,,
"I’ve learned about the cycle that sometimes I will feel those recognizable symptoms: the sense that I’ve hollowed out, retreated a bit too deeply into my mind, forgetful of the happiness I’ve known and worrisome that I won’t feel it again. But I’ve also learned to trust the other swing of the cycle, even when it seems furthest away: that I will come back out, that I’m never too far gone, that I’ll resist the fall into emptiness, and I’ll turn off the episode of whatever show I’m binge-watching, and get dressed, and rejoin the world",,,,,,,,,,,,,,
Feeling is meaning,,,,,,,,,,,,,,
"The more theories there are, the less is usually known",,,,,,,,,,,,,,
"The individual in any really intelligible sense, does not exist apart from his relations with other individuals.",,,,,,,,,,,,,,
Meanings are not grasped but originate and function internally in a social environment,,,,,,,,,,,,,,
"Journalist to Thomas Eddison: Mr. Eddison you have failed 5000 times to invent the light bulb. Give up!?Eddison: Excuse me? I haven't failed 5000 times, I have succeeded 5000 times in showin ways that don't work. I have failed my way to success",,,,,,,,,,,,,,
Luck is a matter of preparation meeting opportunity,,,,,,,,,,,,,,
"Our possessions are not only a reflection of our identity, they are also a major contributor to it",,,,,,,,,,,,,,
What is important to us dictates what we attend to!,,,,,,,,,,,,,,
"Learning is a process you do, not a process that is done to you",,,,,,,,,,,,,,
When the expectations are fulfilled you never realize them. Only when they are not.,,,,,,,,,,,,,,
Mistakes are the engine of education,,,,,,,,,,,,,,
Ethics is a code of values which guide our choices and actions and determines the purpose and course of our lives,,,,,,,,,,,,,,
