"Most of what we say and do is not essential. If you can eliminate it, you'll have more time and more tranquility",,,,,,,,,,,,,,
5 Stoic don'ts: 1) Don't suffer imagined troubles. 2) Don't always have an opinion. 3) Don't be overheard complaining. 4) Don't be all about business. 5) Don't focus on outcomes,,,,,,,,,,,,,,
"Aggressive or rejected people tend to interpret social situations differently compared to other people.For example, children exposed to peer teasing at school or child abuse at home are much more likely to develop high levels of hostile attribution bias (or interpretation/perception bias): the tendency to interpret others' behaviors as having hostile intent, even when ambiguous or benign). This then leads them to behave aggressively at school and at home.Hostile attribution bias is especially linked to ""reactive aggression"" (i.e., impulsive and ""hot-blooded"" aggression that reflects an angry retaliation to perceived provocation)The interpretation bias refers to a person's tendency to unconsciously interpret situations and events in a negative or critical light, even when the situation is not inherently negative. This type of bias can contribute to feelings of insecurity, self-doubt, and low self-esteem, and can be a factor in the development and maintenance of psychological conditions such as anxiety and depression.It is a bias of social information processing (similar to fundamental attribution error) and related to Neuroticism, i.e., to being more sensitive to perceived criticism and more likely to interpret ambiguous statements as negative. This tendency is more prevalent in people high in anxiety, insecurity, and self-doubt.Rejection breeds hostile interpretations.",,,,,,,,,,,,,,
Es mejor decir perdón que pedir permisión,,,,,,,,,,,,,,
"If a person’s behavior doesn’t make sense to you, it is because you are missing a part of their context. If you look at a person’s action (or inaction) and see only laziness, you are missing key details.",,,,,,,,,,,,,,
"One advantage of working in different fields is that you get a variety of experience to inform your opinion. It might be wrong, but it's still well-informed (Claudio Borio @MoneySymposium)",,,,,,,,,,,,,,
Everything is interesting if you go into it deeply enough,,,,,,,,,,,,,,
"It’s writing that forces you to decide what you think about something.""",,,,,,,,,,,,,,
Your actions create the community,,,,,,,,,,,,,,
Write drunk but edit sober,,,,,,,,,,,,,,
Wisdom comes from memory,,,,,,,,,,,,,,
Just imagine how much better it would be if you could source from a different fuel,,,,,,,,,,,,,,
Guilt is when shame becomes associated with itself,,,,,,,,,,,,,,
Excuses are usually lies. And how do you stop lies. With the truth. The truth will set you free and deliver you from procrastination and laziness and downward-spiral that comes with a lack of discipline.,,,,,,,,,,,,,,
I don't view aggression as an outward attitude. I view aggression as an internal character trait,,,,,,,,,,,,,,
"5 Stoic lessons from Epictetus: 1) You become what you give your attention to. 2) Don't explain your philosophy, embody it. 3) To improve, you have to be OK with looking foolish. 4) You can't learn what you think you already know. 5) Stop waiting to demand the best for yourself",,,,,,,,,,,,,,
Contentment is not a feeling of accomplishment from doing something.Contentment is a practice.,,,,,,,,,,,,,,
"When it comes to behavioral “laziness,” I’m especially moved to ask: what are the barriers to action that I can’t see?",,,,,,,,,,,,,,
"Der Wert aller morbiden Zustände ist, daß sie in einem Vergrößerungsglas gewisse Zustände, die normal, aber als normal schlecht sichtbar sind, zeigen",,,,,,,,,,,,,,
"Tough motherfuckers live in the deep end. When they're on top, they go back to where they started. Because growth is in the climb",,,,,,,,,,,,,,
The curse of talent: talented people don't work hard,,,,,,,,,,,,,,
Yesterday is history. Tomorrow is a mystery. But today is a gift. That is why it is called a present,,,,,,,,,,,,,,
"Most people are other people. Their thoughts are someone else's opinions, their lives a mimicry, their passions a quotation",,,,,,,,,,,,,,
You're better off not giving the small things more time than they deserve,,,,,,,,,,,,,,
Regrets are late decisions,,,,,,,,,,,,,,
Patience is waiting. Not passively waiting. That is laziness. But to keep going when the going is hard and slow - that is patience. The two most powerful warriors are patience and time.Leo Tolstoy,,,,,,,,,,,,,,
"Ask yourself: What would this look like if it were easy?If you feel stressed, stretched thin, or overwhelmed, it's usually because you're overcomplicating something. Write it down and put it where you'll constantly see it: SIMPLIFY.",,,,,,,,,,,,,,
"Die Arten der Selbstbetäubung. – Im Innersten: nicht wissen, wohinaus? Leere. Versuch, mitRausch darüber hinwegzukommen: Rausch als Musik, Rausch als Grausamkeit im tragischenGenuß des Zugrundegehens des Edelsten, Rausch als blinde Schwärmerei für einzelneMenschen oder Zeiten (als Haß usw.). – Versuch, besinnungslos zu arbeiten, als Werkzeugder Wissenschaft; die Mystik, der wollüstige Genuß der ewigen Leere; die Kunst „um ihrer selberwillen“ („le fait“), das „reine Erkennen“ als Narkosen des Ekels an sich selber; irgend welchebeständige Arbeit, irgendein kleiner dummer Fanatismus; das Durcheinander aller Mittel,Krankheit durch allgemeine Unmäßigkeit (die Ausschweifung tötet das Vergnügen).",,,,,,,,,,,,,,
"Nachdem man verlernt hat, an diese zu glauben, sucht man doch nach alter Gewöhnung nach einer anderen Autorität, welche unbedingt zu reden wüßte und Ziele und Aufgaben befehlen könnte. Die Autorität des Gewissens tritt jetzt in erster Linie als Schadenersatz für eine persönliche Autorität Man möchte herumkommen um den Willen, um das Wollen eines Zieles, um das Risiko, sich selbst ein Ziel zu geben; man möchte die Verantwortung abwälzen",,,,,,,,,,,,,,
"Was bedeutet Nihilismus? - Daß die obersten Werte sich entwerten. Es fehlt das Ziel; es fehlt die Antwort auf das „Warum?""A. Nihilismus als Zeichen der gesteigerten Macht des Geistes: der aktive Nihilismus.B. Nihilismus als Niedergang und Rückgang der Macht des Geistes: der passive NihilismusEr kann ein Zeichen von Stärke sein, die Kraft des Geistes kann so angewachsen sein, daß ihr die bisherigen Ziele („Überzeugungen"", Glaubensartikel) unangemessen sind (- ein Glaube nämlich drückt im allgemeinen den Zwang von Existenzbedingungen aus, eine Unterwerfung unter die Autorität von Verhältnissen, unter denen ein Wesen gedeiht, wächst, Macht gewinnt...); andrerseits ein Zeichen von nicht genügender Stärke, um produktiv sich nun auch wieder ein Ziel, ein Warum, einen Glauben zu setzen.",,,,,,,,,,,,,,
Die Toleranz als Unfähigkeit zu Ja und Nein (Nietzsche Wille zur Macht),,,,,,,,,,,,,,
"Diese großen schaffenden Menschen - der Theorie oder der Praxis - greifen mit mächtiger Hand in das Rad des Daseins; sie drehen seine Speichen ein Stück vorwärts, indem sie das Gefühl in sich tragen, der Welt neue Kräfte gewinnen zu müssen, nicht anders zu können, als Welt zu gestalten, indem sie sich selbst gestalten. Sie fragen nicht nach dem Werte des Lebens, sie fühlen die furchtbaren Gründe, auf denen es ruht, sie kennen seine Furchtbarkeit und seine Untiefen - und gewinnen daraus Einsicht und Kraft, es neu zu gestalten, ihren Willen zur Macht daran zu erproben, selbst wie göttliche Kräfte, darin zu zerstören, zu vernichten, Altes zu zerbrechen, Verbrecher am Gesetz zu werden, um Neues, Größeres werden zu lassen. Sie sagen „Ja"" zum Gesamtdasein und können darum zu keinem Teil„Nein"" sagen: denn die Notwendigkeit verschlingt alle Dinge untrennbar ineinander, daß man alles Sein bejahen muß, wenn man den kleinsten Teil bejaht. Ihre unendlich strömende Kraft freut sich des Gestaltens an dieser Welt, der einzigen Aufgabe des Menschen, seines Künstlerberufs. Sie kennen keine seiende Welt, nur eine werdende, eine sein sollende, an der Menschen ihr und der Welt Geschick zimmern. An den Widerständen, die sie ihnen bietet, wächst ihre Kraft; ihr Wille zur Macht kann sich nie genug tun, dieser Welt immer neue Gestalten zu geben, von ihrer Fülle, dem Reichtum ihrer Geistes- und Willenskräfte in die Welt hinüberströmen zu lassen. Sie sehen auf diese Welt als ihr Werk und wünschen sich nur eins: stets wieder an ihr zu formen bis in alle Unendlichkeit, immer von neuem wieder, unendlich oft. Sie bejahen dieses Dasein und wünschen, so wie es ist, wie es durch sie und ihren Machtwillen wird, möchte es wiederkehren: in gleicher Form unendlich oft in ewiger Wiederkehr. Diese Sehnsucht, ihrem Machtwillen entstammend, gibt ihnen Kraft - und di neue Kraft gibt ihnen neue Sehnsucht. Die Schwachen aber gehen an dem Gedanken zugrunde, daß dieses Leben unendlich oft wiederkehren möge.Un monstre gai vaut mieux Qu'un sentimental ennuyeux.(Nietzsche Wille zur Macht)",,,,,,,,,,,,,,
"When a person can't find a deep sense of meaning, they distract themselves with pleasure.",,,,,,,,,,,,,,
Love is the only way to grasp another human being in the innermost core of his personality.,,,,,,,,,,,,,,
"In some ways, suffering ceases to be suffering at the moment it finds the meaning, such as the meaning of a sacrifice.",,,,,,,,,,,,,,
"Life without a design is erratic. Without a disciplined schedule, there's chaos and uncertainty - ingredients that feed procrastination.",,,,,,,,,,,,,,
"Gerade wegen dieser Fähigkeit, den Unglücklichen hinzuhalten, galt die Hoffnung bei den Griechen als Übel der Übel, als das eigentlich tückische Übel.",,,,,,,,,,,,,,
"Glaubenssätze müssen nicht wahr sein, um zu wirken.Wenn zum Beispiel ein Glück darin liegt, sich von der Sünde erlöst zu glauben, so thut als Voraussetzung dazu nicht noth, daß der Mensch sündig sei, sondern daß er sich sündig fühlt. (Der Antichrist)",,,,,,,,,,,,,,
The essence of learning is a kind of special dynamic capacity of systems to recombine resources when something changes and to manage feedback coherently,,,,,,,,,,,,,,
"Optimize for now, not for the future",,,,,,,,,,,,,,
React to opportunities,,,,,,,,,,,,,,
"If a man does not keep pace with his companions, perhaps it is because he hears a different drummer. Let him step to the music which he hears.",,,,,,,,,,,,,,
Eccentrics have thrown off the constraints of normal life to let themselves do exactly as they please - and anyone who doesn't like it be damned.,,,,,,,,,,,,,,
"- Authenticity refers to autonomous self-creation of who and what individuals are to become- The source of authenticity is in subjectivity. To become authentic, individuals must transcend enculturation and invent themselves from within- A major aspect of achieving greater authenticity is to access more fully one’s subjectivity- Firmly and consistently challenge yourself to view yourself as a living (in process) being rather than an object to be explained --> experiencing-centered rather than object-centered- Consistently challenge yourself to expand your personal awareness and take ownership of every choice, including explicit or implicit choices that maintain problem issues and struggles- Relinquish nonauthentic choices",,,,,,,,,,,,,,
Change-oriented lesson-drawing requires dissatisfaction with the status quo,,,,,,,,,,,,,,
A man with no future plans will go back to the past,,,,,,,,,,,,,,
The key to developing a deep work habit is to move beyond good intentions and add routines and rituals to your working life designed to minimize the amount of your limited willpower necessary to transition into and maintain a state of unbroken concentration,,,,,,,,,,,,,,
The person who says he knows what he thinks but cannot express it usually does not know what he thinks.,,,,,,,,,,,,,,
The mystery of life is not a problem to solve but a reality to experience.,,,,,,,,,,,,,,
"Don't seek for everything to happen as you wish it would, but rather wish that everything happens as it actually will - then your life will flow well",,,,,,,,,,,,,,
"When you run an ultra, decide now that they will be good memories no matter how the race actually goes. You paid for this, have fun! There was a time when this sounded fun to you, and it absolutely has the potential to be just that.",,,,,,,,,,,,,,
Think of each low moment as an opportunity to be the kind of person you want to be!,,,,,,,,,,,,,,
The best screaming is born out of vulnerability,,,,,,,,,,,,,,
Don't let your imagination be crushed by life as a whole (Aurelius),,,,,,,,,,,,,,
But the real answer to your question is that when it feels scary to jump in that is exactly when you jump. Otherwise you end up staying in the same place your whole life.,,,,,,,,,,,,,,
"Whenever you want to accomplish something, pursuing a goal, narrow your focus of attention. The closer to a goal, the more effort we put in. Focus of attention on a subgoal works because of its Illusion of proximity (gradient goal hypothesis)",,,,,,,,,,,,,,
Don't draw conclusion so fast.,,,,,,,,,,,,,,
Den eigenen Affekt nicht zu ernst nehmen,,,,,,,,,,,,,,
Was wären die besten Diamanten ohne Ecken und Kanten?!,,,,,,,,,,,,,,
"Temporarily, family problems or significant stress can cause a person of any age to have problems with concentration or restlessness. The difference between stress and ADD is history and duration of the difficulties.",,,,,,,,,,,,,,
"When you focus on controlling something, on something you can actually control, then your circle of control begins to widen, that even amidst hardship there is a way to regain power and build a life.",,,,,,,,,,,,,,
"We watch everybody else's Highlights Reel, while living our own Blooper Reel.",,,,,,,,,,,,,,
Everything becomes less dramatic the second time around,,,,,,,,,,,,,,
Time is a social institution and not a physical reality,,,,,,,,,,,,,,
"Der Mensch kann nie wissen, was er wollen soll, weil er nur ein Leben lebt und keine Möglichkeit hat, es mit seinem früheren Leben zu ver",,,,,,,,,,,,,,
"Ruminative responding in major depressive disorder (MDD) is defined as a recurrent, self-reflective, and unintentional focus on depressive symptomatology and its causes and consequences",,,,,,,,,,,,,,
"When your mind is not where you want it to be, look to your body. Use the body to shift the mind.",,,,,,,,,,,,,,
Fostering and celebrating resilience isn't a substitute for removing barriers,,,,,,,,,,,,,,
Define success as having incredible relationships with people and making meaningful work,,,,,,,,,,,,,,
"When you're writing, murder your darling",,,,,,,,,,,,,,
Ultra-Marathon running is about turning negatives into positives,,,,,,,,,,,,,,
Life is the art of letting go. Because hoarding makes you immobile,,,,,,,,,,,,,,
"Sich zu erlauben, Fehler zu machen, würde uns vermutlich erleichtern und beschleunigen, aus unguten Situationen auch wieder rauszugehen. Wir bleiben immer dann in der Situation, wenn wir denken, dass es auch passen können müsste. Wenn wir mit einem experimentier-mindset herantreten würden wir wohl auch viel schneller wieder rausgehen, denn es war ja nur ein Experiment.Die Zeit und Energie, die es uns kostet, Fehler zu vermeiden, ist in Summe viel größer als die zum Korrigieren. Vermeidungsmotivation lähmt; Fehler korrigieren aktiviert. Keine Fehler kann ich nicht korrigieren.Wir Deutschen sind Entscheidungskonservativ.Lieber keine Entscheidung als eine Entscheidung und lieber die sichere Variante als die unsichere.Es wird uns Deutschen nie etwas passieren, aber wir werden halt auch nie etwas erleben",,,,,,,,,,,,,,
Mindfulness is paying attention to one’s current experience in a non-evaluative way,,,,,,,,,,,,,,
"Es ist ein grundlegendes Streben, das unsere Existenz bestimmt: das Streben nach Zufriedenheit. Das Erleben von Zufriedenheit hängt aber nicht so sehr vom erreichten Erfolg ab als vielmehr von der investierten Anstrengung, die zum Erfolg geführt hat. Ein gutes Ergebnis, dass sich ohne Anstrengung erreichen ließ, erzeugt keine Zufriedenheit.",,,,,,,,,,,,,,
There is somewhat of an illusion of agency in a highly structured environment. Structured environments automate behavior.,,,,,,,,,,,,,,
Pursuing your dreams is supposed to make you happy,,,,,,,,,,,,,,
"Was kratzt es die Eiche, wenn sich eine Wildsau dran reibt?",,,,,,,,,,,,,,
(Ocean - John Butler) This sounds like what life should feel like.,,,,,,,,,,,,,,
Die Sorge vor negativen Konsequenzen verlängert nur den Leidensweg und am Ende stehen die Konsequenzen trotzdem ins Haus,,,,,,,,,,,,,,
I get up every morning determined to both change the world and have one hell of a good time. Sometimes this makes planning my day difficult.” -E.B. White,,,,,,,,,,,,,,
Vanilla is for ice cream only,,,,,,,,,,,,,,
Rules for expert systems are formulated only because the systems require it; rules are characteristic of expert systems but not of real human experts.,,,,,,,,,,,,,,
Whiskey is sunlight held together by water,,,,,,,,,,,,,,
"People who regard themselves as highly efficacious produce their own future, rather than simply foretell it",,,,,,,,,,,,,,
"Society educates us to be in a constant state of preparation. Preparation for the next step. We're raised with a perpetual need for a future. At at some time, however, it will dawn upon us that we have already arrived",,,,,,,,,,,,,,
"Become instantaneous, momentary. Letting the bow go at the same time as the decision to shoot",,,,,,,,,,,,,,
"Wer nicht in diese Welt zu passen scheint, ist nahe dran, sich selbst zu finden",,,,,,,,,,,,,,
"In vielen Ländern des Geistes zu Hause, mindestens zu Gaste gewesen; den dumpfen angenehmen Winkeln immer wieder entschlüpft, in die uns Vorliebe und Vorhaß, Jugend, Abkunft, der Zufall von Menschen und Büchern, oder selbst die Ermüdungen der Wanderschaft zu bannen schienen; voller Bosheit gegen die Lockmittel der Abhängigkeit, welche in Ehren, oder Geld, oder Ämtern, oder Begeisterungen der Sinne versteckt liegen; dankbar sogar gegen Not und wechselreiche Krankheit, weil sie uns immer von irgendeiner Regel und ihrem »Vorurteil« losmachte, dankbar gegen Gott, Teufel, Schaf und Wurm in uns, neugierig bis zum Laster, Forscher bis zur Grausamkeit, mit unbedenklichen Fingern für Unfaßbares, mit Zähnen und Mägen für das Unverdaulichste, bereit zu jedem Handwerk, das Scharfsinn und scharfe Sinne verlangt, bereit zu jedem Wagnis, dank einem Überschusse von »freiem Willen«, mit Vorder- und Hinterseelen, denen keiner leicht in die letzten Absichten sieht, mit Vorder- und Hintergründen, welche kein Fuß zu Ende laufen dürfte, Verborgne unter den Mänteln des Lichts, Erobernde, ob wir gleich Erben und Verschwendern gleichsehn, Ordner und Sammler von früh bis abend, Geizhälse unsres Reichtums und unsrer vollgestopften Schubfächer, haushälterisch im Lernen und Vergessen, erfinderisch in Schematen, mitunter stolz auf Kategorien-Tafeln, mitunter Pedanten, mitunter Nachteulen der Arbeit auch am hellen Tage; ja wenn es nottut, selbst Vogelscheuchen – und heute tut es not: nämlich insofern wir die gebornen geschwornen eifersüchtigen Freunde der Einsamkeit sind, unsrer eignen tiefsten mitternächtlichsten, mittäglichsten Einsamkeit – eine solche Art Menschen sind wir, wir freien Geister! und vielleicht seid auch ihr etwas davon, ihr Kommenden? ihr neuen Philosophen?",,,,,,,,,,,,,,
When you have ADHD trying harder is rarely the answer. The answer lies in trying differently. Find what works for you,,,,,,,,,,,,,,
Wer nur in andere Fußstapfen tritt hinterlässt keine Spuren,,,,,,,,,,,,,,
"Wem das Schicksal hart gibt, der ist für Großes bestimmt",,,,,,,,,,,,,,
"Nur wer etwas riskiert, kann triumphieren",,,,,,,,,,,,,,
The depth of a concept continues to reveal itself through the process of living it,,,,,,,,,,,,,,
"Indem wir Spätmodernen auf allen genannten Ebenen - individuell, kulturell, institutionell und strukturell - auf die Verfügbarmachung von Welt zielen, begegnet uns die Welt stets als »Aggressionspunkt« oder als Serie vonAggressionspunkten, das heißt von Objekten, die es zu wisen, zu erreichen, zu erobern, zu beherrschen oder zu nutzen gilt, und genau dadurch scheint sich unsdas »Leben«, das, was die Erfahrung von Lebendigkeit und von Begegnung ausmacht - das, was Resonanz ermöglicht -, zu entziehen, was wiederum zu Angst, Frust, Wut, ja Verzweiflung führt, die sich dann unter anderem in ohnmächtigem politischem Aggressionsverhalten niederschlagen.",,,,,,,,,,,,,,
I think I'd be much more into tinkering if I weren't so paranoid about upsetting a presently-working configuration. Stupid stability addiction.,,,,,,,,,,,,,,
You don't have to turn this into something. It doesn't have to upset you,,,,,,,,,,,,,,
"Here is a rule to remember in future, when anything tempts you to feel bitter: not This is misfortune, but To bear this worthily is good fortune.",,,,,,,,,,,,,,
"The object of life is not to be on the side of the majority, but to escape finding oneself in the ranks of the insane",,,,,,,,,,,,,,
How difficult it is to move on a long-term trajectory when short-term exigencies demand something quite different.,,,,,,,,,,,,,,
"Strong goal commitment reduces decision fatigue. If you are focused on a goal and its attainment, you don't have to constantly ask yourself what to do today.",,,,,,,,,,,,,,
Las palabras son como las abejas: algunas tienen miel y otras aguijón,,,,,,,,,,,,,,
Más ocupa un enemigo en tu cabeza que un amigo en tu corazón,,,,,,,,,,,,,,
La muerte está tan segura de su victoria que nos da la vida como ventaja,,,,,,,,,,,,,,
"Ein Lächeln zeichnet sich durch hochgezogene Mundwinkel aus und diese kann man nur von vorne sehen, nicht von der Seite. Das Wesentliche sieht man nur, wenn man den Dingen, vor allem aber dem Menschen, ins Gesicht schaut. ( von mir)",,,,,,,,,,,,,,
"Freedom does not consist in the dream of independence of natural laws, but in the knowledge of these laws and in the possibility this gives of systematically making them work towards definite ends",,,,,,,,,,,,,,
"Mitten im tiefsten Winter wurde mir endlich bewusst, dass in mir ein unbesiegbarer Sommer wohnt (Camus)",,,,,,,,,,,,,,
A crucial difference between extrinsic and intrinsic motivation is that you usually don't have control over extrinsic motivation.,,,,,,,,,,,,,,
Cold silence has a tendency to Atrophy any sense of compassion,,,,,,,,,,,,,,
"Wer Lob ablehnt, macht sich einsam; kappt die Verbindung.",,,,,,,,,,,,,,
Be mindful when it is time for conciliatory politics and staying at the table.,,,,,,,,,,,,,,
"Only the disciplined ones are free in life. If you are undisciplined, you are a slave to your moods",,,,,,,,,,,,,,
Good instincts are earned by making mistakes,,,,,,,,,,,,,,
"That God became man indicates only this: that man should not seek his salvation in eternity, but rather establish his heaven on earth. – Nietzsche",,,,,,,,,,,,,,
"Wir sind so geprägt worden, zu suchen nach Dingen, die Sinn haben statt Dinge einfach z tun und ihnen Sinn zuzuschreiben",,,,,,,,,,,,,,
Not all those who wander are lost,,,,,,,,,,,,,,
Our minds always try to find the easier path,,,,,,,,,,,,,,
Humor gives you control back over your emotions,,,,,,,,,,,,,,
You must pay for conversation,,,,,,,,,,,,,,
We always believe that we're missing something; and that this something lies usually in the future,,,,,,,,,,,,,,
They say there's always light at the end of the tunnel. But not once you're eyes have adjusted to the darkness.,,,,,,,,,,,,,,
"Stop hiding from your weaknesses. Get the fuck real and look yourself in the mirror. You're not unmotivated, you're a fucking lazy slacker. You keep on thinking instead of acting to avoid the uncomfortable truth: action is much harder than thought.I'm a fricking scout for paths of least resistance.If you want to start a day, get out of your fucking mental bed!",,,,,,,,,,,,,,
We often value other people's opinions without considering the minds that generated them,,,,,,,,,,,,,,
Train yourself to crave discomfort,,,,,,,,,,,,,,
Onpy you can master your mind,,,,,,,,,,,,,,
Don't stop when you're tired. Stop when you're done,,,,,,,,,,,,,,
"Kreativität betritt die Bühne nur, wenn sie wirklich frei ist",,,,,,,,,,,,,,
"Cuando no eres consciente de tu dependencia respecto a la mirada de los demás, vives temblando frente al posible abandono de los otros que, como todos, aprendiste a temer.",,,,,,,,,,,,,,
Time without a purpose is a prison,,,,,,,,,,,,,,
"We all must repress forbidden impulses, which are always at the ready to pop out in dreams, symptoms, or works of art - we are different only in the balance of forces and their means of expression.",,,,,,,,,,,,,,
"Was ich behielt ging verloren, und was ich gab, ist mein. Alles, was ich weggab, das habe ich immer noch, und alles, was ich behielt, ist verloren, ist fort.",,,,,,,,,,,,,,
Sincerity doesn't save one from complicity,,,,,,,,,,,,,,
"Scientifically, humiliation is the strongest human emotion. Stronger than love, sorrow, or hate. Nothing, but nothing good comes of it. It's mere cruelty",,,,,,,,,,,,,,
We’re a generation of men raised by women. I’m wondering if another woman is really the answer we need.,,,,,,,,,,,,,,
"We've all been raised on television to believe that one day we'd all be millionaires, and movie gods, and rock stars. But we won't. And we're slowly learning that fact. And we're very, very pissed off.",,,,,,,,,,,,,,
