"The application office was very small, with room for perhaps five people to sit inside. On most days I would see at least twenty people outside, waiting in line to get in. Just outside the building was a wall about three feet high. The people in line often sat on the wall. It's easy to understand why. They might have more than an hour's wait in the hot Florida sun. Whoever managed the passport office was offended by people sitting on the wall. I would see sheets of paper that read ""Do not sit on the wall"" taped to the wall. The signs were routinely ignored. The workers in the passport office didn't want people sitting on the wall, but they didn't hink about why people sat on the wall. When you're waiting in a hot concrete courtyard for an hour, you're going to get tired and want to sit down. The rule was guaranteed to fail. A more effective way to prevent people from sitting on the wall, if that was really a problem. would have been to address the need rather than the action-say by installing benches.The memory of that office and its courtyard has stuck with me. In my own relationships, when I see people doing things I'd rather they didn't do, I try to find out why they're doing it and what might help take care of the need. I try to put benches in the courtyard, rather than putting up signs telling them not to sit on the wall.",,,,,,,,,,,,,,
"Empowered relationships rely on trust. Trust your partner to want to cherish and support you. Trust that if you make your needs known, your partner will want to meet your needs. This requires courage. Building relationships on a shared understanding of needs means having the courage to stand in the face of a negative emotion and ask, ""What is this feeling telling me?"" Is there a need that is not being met? Is there something I can do to enlist my partner as my ally in dealing with this?",,,,,,,,,,,,,,
"The necessity of letting go of the bow string without first deciding to do so.The decision to release the bow string and the act of doing so must be simultaneous. Not to decide and then act but to decide and act all at once.Now why is this? If you are going to be an expert archer, you must shoot before you think.If you decide before you act, the devil will catch you.",,,,,,,,,,,,,,
If you're going out with the devil it is terribly important that you don't give him any advance notice,,,,,,,,,,,,,,
"The primary issue in jealousy is fear of losing something, whether that’s exclusive sexual access, love, attention, reputation, self-esteem, or any of the other jealousy triggers",,,,,,,,,,,,,,
Jealousy most often arises when a person’s need for control is threatened.,,,,,,,,,,,,,,
"In the end, the only way out of jealousy is through it",,,,,,,,,,,,,,
Man has an innate tendency to go up to the maximum of his stress tolerance (Hans Selye),,,,,,,,,,,,,,
"The secret of change is to focus all your energy not on fighting the old, but on building the new",,,,,,,,,,,,,,
"When people say ""I could never do this. I value commitment too highly"", what they're saying is that they're committed to monogamy, not the people they are married to.",,,,,,,,,,,,,,
"Reading existential philosophy doesn't make your realize that ""life is meaningless"", it makes you realize that life is too meaningful for you to let it pass you by, like a movie, with you as nothing but a passive observer.",,,,,,,,,,,,,,
Relationship magnifies everything else,,,,,,,,,,,,,,
Rejection breeds obsession,,,,,,,,,,,,,,
Being alone becomes beautiful when you've got somewhere and someone to return to,,,,,,,,,,,,,,
"Men are socialized to be a “man,"" which to many means that they are independent and strong, that they don’t need anyone else, and are not vulnerable. It means that if they get a feeling that they were criticized or rejected, a feeling that they were hurt, they can’t stay there. Instead, they either get angry or withdraw or tell themselves they can handle it and it isn’t even that big of a deal.Normative male alexithymia refers to the fact that traditional masculine role socialization channels many men into ways of being such that their masculine identity conflicts with many emotions they feel and what they feel they are “allowed” to express (i.e., they will be shamed and will feel as if they are ""not real men"" if they express feelings of vulnerability, dependency needs, weakness, etc.).From: https://www.psychologytoday.com/us/blog/theory-knowledge/201411/why-is-it-so-hard-some-men-share-their-feelings",,,,,,,,,,,,,,
Worry is a misuse of your imagination,,,,,,,,,,,,,,
"What is increasingly recognized about the architecture of the human brain is its peculiar suitability, not for the serial processing required for developing logical structures, but for the formation of elaborate networks of connections.",,,,,,,,,,,,,,
We have a tendency to define ourselves in opposition to stuff,,,,,,,,,,,,,,
We didn't evolve to be constantly content. Contended homo erectus got eaten before passing on their genes,,,,,,,,,,,,,,
"Happiness is like an orgasm, if you think about it too much it goes away",,,,,,,,,,,,,,
"Free your mind of the idea of deserving, of the idea of earning, and you will begin to be able to think. (Le Guin)",,,,,,,,,,,,,,
"Smartphone addiction, while not life endangering, is, in one critical respect, the same as any other – it represents a form of escape, a way to engage, if only in the short term, in a less challenging, more instantly gratifying, reality.",,,,,,,,,,,,,,
Perfectionists may over-value performance and undervalue the self. He learns only through performance that he has a self,,,,,,,,,,,,,,
"We perceive the world before we react to it, and we react not to what we perceive, but always to what we infer.",,,,,,,,,,,,,,
"Stimulus and reaction, in this temporal order, is deceiving because we do not react to the past stimulus, but to the image of a future state of affairs",,,,,,,,,,,,,,
"Während sich der Habemensch auf das verlässt, was er hat, vertraut der Seinsmensch auf die Tatsache, dass er ist, dass er lebendig ist und dass etwas Neues entstehen wird, wenn er nur den Mut hat, loszulassen und zu anworten.",,,,,,,,,,,,,,
Control can sometimes be an illusion. But sometimes you need illusion to gain control,,,,,,,,,,,,,,
"Sinn macht vieles, vielleicht alles, ertragbar. C.G. Jung",,,,,,,,,,,,,,
"Verzweiflung ist ein Durcheinander in der Wertehierarchie, die Vergötzung und Verabsolutierung eines Wertes",,,,,,,,,,,,,,
The opposite of depression is not happiness but vitality,,,,,,,,,,,,,,
"If you know what you've got, you ain't got much",,,,,,,,,,,,,,
"Offence isn't given, it's taken",,,,,,,,,,,,,,
"Joy is the one thing that requires know no justification, that is it's own justification",,,,,,,,,,,,,,
"A legitimate child is a continuation of a man's ego, and his affection for the child is a form of egoism",,,,,,,,,,,,,,
Judgements of others contribute to self-fulfilling prophecies,,,,,,,,,,,,,,
Put your life first and your property second,,,,,,,,,,,,,,
"There is no such thing as absolute certainty, but there is assurance sufficient for the purposes of human life",,,,,,,,,,,,,,
The difference between the university graduate and the autodidact lies not so much in the extent of knowledge as in the extent of vitality and self-confidence,,,,,,,,,,,,,,
"Verlierer hören auf, wenn sie scheitern. Gewinner scheitern bis sie Erfolg haben",,,,,,,,,,,,,,
"""Aber was ist normal? Einerseits alles, was der Fall ist, das Gegebene, Alltägliche. Andererseits aber bedeutet ""normal"" etwas Normatives, also das Gewünschte. Auf diese Weise wird Normalität zu einem zweischneidigen Schwert. Man kann den Menschen am Gegebenen messen und zu dem Ergebnis kommen, er sei normal, gesund und und folglich gut. Oder man erhebt das Gewünschte zum Maßstab und stellt fest, dass der Betreffende gescheitert sei.""",,,,,,,,,,,,,,
"Complexity is relative (to space and time, i.e. for whom and when in human history)",,,,,,,,,,,,,,
Making something better doesn't make it good,,,,,,,,,,,,,,
Defeat is a hard experience to master: the temptation is always to sublimate it,,,,,,,,,,,,,,
"I cannot teach them anything, I can only make them think (Socrates)",,,,,,,,,,,,,,
‘Where should I go?’ -Alice. ‘That depends on where you want to end up.’- The Cheshire Cat.”,,,,,,,,,,,,,,
"Asking ""What do I want to achieve"" is goal-oriented and not process-oriented",,,,,,,,,,,,,,
"Je schöner etwas ist, desto schwächer ist Sprache als Ausdruck für diese Schönheit",,,,,,,,,,,,,,
"Abgrenzung ist nicht gleich Isolation. Wenn wir Ruhe brauchen, wollen wir nicht von unseren sozialen Beziehungen isoliert sein.",,,,,,,,,,,,,,
Der vom Wollen befreite Kopf hat Raum für Gedankenspiele. Aber die Gedanken sind nicht mehr auf ein Ziel gerichtet. Sie weisen in keine Richtung mehr.,,,,,,,,,,,,,,
Learn to master the art failing successfully,,,,,,,,,,,,,,
"Wenn du versuchst, mit Meditieren etwas zu erreichen, meditierst du nicht",,,,,,,,,,,,,,
"Wenn wir wirklich gehört werden mit unseren Bedürfnissen und Gefühlen, ändern wir uns",,,,,,,,,,,,,,
The things you own end up owning you,,,,,,,,,,,,,,
"Independent learning suggests ideas such as “self-taught,” or “autodidact.” These imply that independence meansworking solo. But that’s just not how it happens. People don’t learn in isolation. When I talk about independent learners, I don’t mean peoplelearning alone. I’m talking about learning that happens independent of schools.Anyone who really wants to learn without school has to find other people to learn with and from. That’s the open secret of learningoutside of school. It’s a social act. Learning is something we do together. Independent learners are interdependent learners",,,,,,,,,,,,,,
"Tant qu'on n'a pas choisi, tout reste possible",,,,,,,,,,,,,,
"A loser is someone who, after making a mistake, doesn’t introspect, doesn’t exploit it, feels embarrassed and defensive rather thanenriched with a new piece of information, and tries to explain why he made the mistake rather than moving on. These types often consider themselves the “victims” of some large plot, a bad boss, or bad weather.",,,,,,,,,,,,,,
Errors and their consequences are information,,,,,,,,,,,,,,
Humans somehow fail to recognize situations outside the contexts in which they usually learn about them,,,,,,,,,,,,,,
"Depriving systems of stressors, vital stressors, is not necessarily a good thing and can be downright harmful",,,,,,,,,,,,,,
Careerism: The debasing of knowledge by turning it into a competitive sport,,,,,,,,,,,,,,
"The Extended Disorder Family (or Cluster): (i) uncertainty, (ii) variability, (iii) imperfect, incomplete knowledge, (iv) chance, (v) chaos, (vi) volatility, (vii)disorder, (viii) entropy, (ix) time, (x) the unknown, ( xi) randomness, (xii) turmoil, (xiii) stressor, (xiv) error, (xv) dispersion of outcomes, (xvi) unknowledge.",,,,,,,,,,,,,,
You get pseudo-order when you seek order; you only get a measure of order and control when you embrace randomness,,,,,,,,,,,,,,
"Lernen kann man immer und überall und von jedem. Und die wichtigsten Lektionen sind oft die ungeplante, manchmal sogar ungewollten",,,,,,,,,,,,,,
"A skill is an ability to act in a flexible way that is responsive to features of the given environment with the result that action or interaction is enhanced or facilitated, or the environment is transformed in ways that are positively valued.One of the signs that I have acquired a skill, rather than that I have been simply mechanically repeating things I have seen others do, isthat I can attain interesting and positively valued results in a variety of different and unexpected circumstances.",,,,,,,,,,,,,,
"It's never the behavior that tells you whether it's addiction or not; it's your relationship to it. Any relationship that has craving, pleasure and relief associated with it in the short-term but negative consequences in the long-term is addictive.So you have people engaging in supposedly healthy activities but in a completely unhealthy way. One person might be doing it as a way of not dealing with issues in their life, as a way of diverting themselves from the emotional distress",,,,,,,,,,,,,,
True focus lies somewhere between rage and serenity,,,,,,,,,,,,,,
Crises refine life. In them you discover what you are,,,,,,,,,,,,,,
"When you fail, never give up, because 'FAIL' means 'First Attempts In Learning'.End is not the end. In fact, 'END' means 'Effort Never Dies'.If you get no as an answer, remember 'NO' means 'Next Opportunity'.",,,,,,,,,,,,,,
Metaphysical views are of utmost importance for the well-being of the human psyche,,,,,,,,,,,,,,
What’s the use for running if you’re on the wrong road?,,,,,,,,,,,,,,
High levels of self-criticism are commonly observed in depression and may be both a causative and a maintenance factor,,,,,,,,,,,,,,
There is no such thing as love without the anticipation of loss,,,,,,,,,,,,,,
The opposite of depression is not happiness but vitality,,,,,,,,,,,,,,
What lies behind us and what lies before us are tiny matters compared to what lies within us,,,,,,,,,,,,,,
Never let fear decide your fate. Always do what you're afraid to do.,,,,,,,,,,,,,,
How easy it is for us to forget how to love,,,,,,,,,,,,,,
Comparison is the thief of joy,,,,,,,,,,,,,,
"We often want to fix and change our emotions, but at the deepest level, nothing is broken",,,,,,,,,,,,,,
Other people do not have to change for us to experience peace of mind,,,,,,,,,,,,,,
"Ultimately, we should not ask what the meaning of our life is, but recognize that it is we who are asked",,,,,,,,,,,,,,
"Feelings of worth can flourish only in an atmosphere where individual differences are appreciated, mistakes are tolerated, communication is open, and rules are flexible",,,,,,,,,,,,,,
"In the ways we are generous or not, we can change the course of someone's life",,,,,,,,,,,,,,
"Wenn du es eilig hast, mach langsam; wenn du es besonders eilig hast, mach einen Umweg",,,,,,,,,,,,,,
"Authenticity is not a goal that is arrived at, but rather is a continual process or manner of living that can be chosen every day and every moment",,,,,,,,,,,,,,
Fear of errors closes people off to learning and growth,,,,,,,,,,,,,,
"Our greatest glory is not in never falling, but in rising every time we fall",,,,,,,,,,,,,,
Relationship is self-disclosure,,,,,,,,,,,,,,
Understanding that you can't truly take credit for your successes nor truly blame others for their failures will humble you and make you more compassionate,,,,,,,,,,,,,,
"Often, how we define a problem determines how we attempt to solve it",,,,,,,,,,,,,,
Accept your lack of knowledge and use it as your asset,,,,,,,,,,,,,,
"Glück ist, wenn man dafür geliebt wird, wer man ist",,,,,,,,,,,,,,
"Heimat ist, wo ich verstehe und verstanden werde",,,,,,,,,,,,,,
Success is something that helps others and at the same time makes you feel happy as you are working on it,,,,,,,,,,,,,,
"Religion controls your beliefs, and makes sure that the non-conforming beliefs align",,,,,,,,,,,,,,
"""Glücksmomente"" suggeriert, dass Glück eine Aneinanderreihung wolliger Gefühle sei. Wahres Glück überdauert den Moment",,,,,,,,,,,,,,
Verliere dich nicht in der Mitte,,,,,,,,,,,,,,
Strukturelle Probleme lassen sich auch nur auf der strukturellen Ebene lösen,,,,,,,,,,,,,,
"There is some place where your specialities can shine. Somewhere that difference can be expressed. It's up to you to find it, and you can",,,,,,,,,,,,,,
Gefühle haben und nicht Gefühle sein,,,,,,,,,,,,,,
"Erwartungen lassen keinen Raum für Fehler, für Lernen, für Scheitern, für Wachsen",,,,,,,,,,,,,,
"Goals frame what people attend to, what knowledge becomes cognitively accessible, how people evaluate various aspects of the situation, and what alternative are being considered",,,,,,,,,,,,,,
Learn to fail or fail to learn,,,,,,,,,,,,,,
Imagine how the future is like when you have succeeded. How does it look like?,,,,,,,,,,,,,,
Fang an bevor du anfängst,,,,,,,,,,,,,,
To fail is a natural consequence of trying. To succeed takes time and prolonge effort in the face of unfriendly odds. To think it'll be any other way is to invite yourself to be hurt and to limit your enthusiasm,,,,,,,,,,,,,,
You must begin to think of yourself as becoming the person you want to be,,,,,,,,,,,,,,
The best is yet to come,,,,,,,,,,,,,,
"People with ecosystem orientation perceive themselves as interconnected with others. They prioritize the needs of others, not out of virtue or self-sacrifice, but because they understand these connections and consequently care about the well-being of others",,,,,,,,,,,,,,
Entscheidungen führen oft zu einer Haltung des sich-aus-der-Affäre-ziehen. Zuwendung und Fokus müssen aber ständig genährt werden,,,,,,,,,,,,,,
"Entscheidung ist ein Prozess; denn Entscheidungen basieren auf Fakten und diese ändern sich, genauso wie meine Bewertung derer",,,,,,,,,,,,,,
"Vollkommene Offenheit ist eine Strategie, ein Prinzip, um ein Bedürfnis zu erfüllen. Wenn die Offenheit darüber steht, hat sie den Sinn verfehlt und ist zum Dogma geworden.",,,,,,,,,,,,,,
Was ist Leistung und warum ist sie so definiert?,,,,,,,,,,,,,,
"Beziehung ist, immer wieder darum zu ringen, echte Begegnung zu schaffen",,,,,,,,,,,,,,
Your interaction with the world changes the way you think and vice versa,,,,,,,,,,,,,,
"Bereue nie was du getan hast, wenn du es zum Zeitpunkt des Geschehen auch wirklich wolltest",,,,,,,,,,,,,,
Adopt the pace of nature: her secret is patience,,,,,,,,,,,,,,
"Wenn ich mit jemandem rede, mache ich mir keine Gedanken über das, was ich sehe oder weiß über den anderen, sondern konzentriere mich nur auf das, was ich höre",,,,,,,,,,,,,,
Um glücklich zu sein brauchen wir einen Tropfen Heite,,,,,,,,,,,,,,
The one thing you can't take away from me is the way I choose to respond to what you do to me. The last of one's freedoms is the ability to choose one's attitude in any given circumstance,,,,,,,,,,,,,,
"Wenn wir Analyse und Intuition gegenüberstellen, dann ist keines von beiden an sich gut oder schlecht. Schlecht wird es erst, wenn man eines von beiden im falschen Moment einsetzt",,,,,,,,,,,,,,
"If there is something bad, sick or unsound, let it inwardly be and breathe. That is the only way it can evolve and change into the form it needs",,,,,,,,,,,,,,
"Authenticity involves acknowledging and representing one's true self, values, beliefs and behaviors to oneself and others",,,,,,,,,,,,,,
The only reality is now,,,,,,,,,,,,,,
"The self-fulfilling prophecy is, in the beginning, a false definition of the situation, evoking a new behavior which makes the original false conception come true",,,,,,,,,,,,,,
"Ich war auf dem Berg, habe den Gipfel gesehen, habe die dünne Luft gespührt, bin wieder umgekehrt, möchte im Tal leben, bei den Menschen. (von Ben)",,,,,,,,,,,,,,
"I struggled with each of these pieces and hurdles; and I was uncertain about what they meant, and often confused. Then I tried to put together what I was seeing",,,,,,,,,,,,,,
Growth may sometimes involve giving up what one already believes and other times seeing its value in a a new context rather than giving it up,,,,,,,,,,,,,,
Heute werden aus Krankheiten aus Eigenschaften gemacht,,,,,,,,,,,,,,
Being closer to the truth can never a harmful or dangerous or unsatisfying thing,,,,,,,,,,,,,,
Work accomplished = time spent x intensity of focus,,,,,,,,,,,,,,
"These movers and shakers didn't achieve success by making success their goal. For them, it was a by-product of following their intellectual curiosity, solving useful problems, and taking risks in order to learn and grow",,,,,,,,,,,,,,
"Lebe so, dass dir deine Aktivitäten mehr Kraft geben, als du in sie reinsteckst",,,,,,,,,,,,,,
"Behandle die Menschen so, als wären sie, was sie sein sollten, und du hilfst ihnen zu werden, was sie sein können",,,,,,,,,,,,,,
"Once our needs are satisfied, our wants escalate",,,,,,,,,,,,,,
"When you've got a match between yourself and your environment, that's when and where you're at home",,,,,,,,,,,,,,
"Die Welt hat genug für jedermann's Bedürfnisse, aber nicht für jedermann's Gier",,,,,,,,,,,,,,
"Nuestra primera obligación es entender. Entender, por supuesto, no significa disculpar o justificar, mejor dicho: significa lo contrario",,,,,,,,,,,,,,
"Imagine a young woman standing near a forest on a plain of green grass. She's busy using a shovel to dig into the ground and throw the earth next to her on the grass. Next to her there is standing a grim man who is busy loading the earth on his barrow and transporting it away. The work the woman is doing is strenuous and she hasn't had a whole lot of breaks. As a matter of fact, she hasn't had any real break from it during the last two year. On a daily basis she has just enough breaks to replenish her energy, eat a bit and sleep. The woman, although she knows that she has been doing this since she can think, never got to know why she is doing what she is doing. The only thing she does know is that whenever she stops to think and question what is going on, the grim man besides her starts to shout and get out his whip. The woman learns quickly that she can please the man and consequently be spared the pain if she just keeps on going and whenever she is able to work faster and dig out more mud for the man, he will have mercy and throw a piece of bread in front of her on the ground. After some time, the woman has dug quite a big hole in the ground, 2 meters deep and 2 meters in length and width. At one point she dares to look up from her work and opens her eyes to what is going on around her. She suddenly realizes that there are more women, all engaged in the same work and similarly frightened to ever stop and think, to say nothing of asking the grim man why he is forcing them to dig and dig. Actually, they all seem quite happy at the same time because they have amassed a small portion of breads on the ground. No one ever understood how they came to this place and why they do what they do. No one wondered how the others might have got here or where the grim man comes from. Everyone just knows that you have to keep on working to be spared the intolerable pain and to be more efficient to possibly get a treat of bread. It's beyond the women's imagination to ask what they are digging for, where the mud is going to and what its used for. They don't talk to each other nor do they empathize with each other by giving a little smile to the other women. They know this is not tolerated by the grim man. When one woman did finally dare to give a comforting smile to the very young and desperate woman next to her, the grim man got incredibly angry. From that point in time he took it as his mission to never let them smile again. He told each and every woman that from now on the breaks would be less and the portions to eat even more sparse. However, he told them that each day he would hand out two breads to the two most hard-working women. No more smile from this point in time. No",more empathy. Only ever more narrow-minded working to dig deeper,and,"faster.One tragic day, the women suddenly see what they were digging for. Not that they knew what the mud was for - it had always been transported away. But when one of the women was to weak",to,"continue to work, the grim man took a gun from beneath his coat, shot the woman and pushed her into the hole she had",dug. Graves. These were their graves. But not a moment,"passed until the grim man angrily shouted at the other women to immediately continue to work and speed up. The women, dazzled by what just happened, rushed back to their work station and continued. No one thought about what happened. No one even had a glimpse of a moment to consider what this could mean for themselves. No one dared to think that they might suffer from the same consequence. At least, they comforted themselves in their minds, it wouldn't hit them as long as they continued to please the old man.No one ever asked how they came to this place. No one ever wondered why they lived the way they do. No thought on where the grim man came from. No swift consideration of how the future might look like for them. As a matter of fact, no",thinking about the future at all. No wondering,"of why the man had the gun and the women only the barrows. No one wondered how the others might feel like. On the contrary, each woman wished that the others might feel badly so that the she could get the special portion of bread this day. No one dared to pose a question to the grim man. No one even had the time to think or feel sad because the longer a woman paused the faster the grim man came running to her work station, already pulling his gun. No one",,,,,
"Schiefgehen kann etwas nur dann, wenn es immer gerade gehen muss. (von mir)",,,,,,,,,,,,,,
Do you really think I care for you so little that betraying me would make a difference?!,,,,,,,,,,,,,,
