"""Up in our country we are human! "" said the hunter. ""And since we are human we help each other. We don't like to hear anybody say thanks for that. What I get today you may get tomorrow. Up here we say that by gifts one makes slaves and by whips one makes dogs.""This is about the refusal to calculate credits and debits can be found throughout the anthropological literature on egalitarian hunting societies. Rather than seeing himself as human because he could make economic calculations, the hunter insisted that being truly human meant refusing to make such calculations, refusing to measure or remember who had given what to whom, for the precise reason that doing so would inevitably create a world where we began ""comparing power with power, measuring, calculating"" and reducing each other to slaves or dogs through debt.",,,,,,,,,,,,,,
"Nicht die Not des Menschen, sondern das, was er daraus macht, ist oft das Problem",,,,,,,,,,,,,,
"What I learned from Tetris is that if you fit in, you disappear!",,,,,,,,,,,,,,
"We only see the events, never the rules. We see the product and facts, not the mechanisms",,,,,,,,,,,,,,
"Wer die Dinge benennt, beherrscht sie. Definitionen schaffen 'Realitäten'.",,,,,,,,,,,,,,
Gefühle brauchen keine Berechtigung,,,,,,,,,,,,,,
"Empathie ist in der Gegenwart. Das was uns hiflt, mit dem Lebendigen Verbindung aufzunehmen, nennen wir Gefühle und Bedürfnisse",,,,,,,,,,,,,,
The point is not how good you are when you are good but how good you are when you're not,,,,,,,,,,,,,,
"Wirklicher Dialog ensteht erst dann, wenn beide Seiten bereit sind, sich zu ändern",,,,,,,,,,,,,,
It appears that the way people perceive the world is much more important to happiness than objective circumstances,,,,,,,,,,,,,,
We end up less satisfied with the result of a choice than we would be if we had fewer options to choose from. Opportunity costs subtract from the original satisfaction.,,,,,,,,,,,,,,
"Empathie findet immer im Jetzt statt. Einfühlung heißt, die Geschichten, Theorien und Interpretationen zu übersetzen",,,,,,,,,,,,,,
"When I look at the world I tend to become pessimistic, but when I look at people I am optimistic",,,,,,,,,,,,,,
"If you want to truly understand something, try to change it",,,,,,,,,,,,,,
The only thing that stands between a man and what he wants from life is often merely the will to try it and the faith to believe that it is possible,,,,,,,,,,,,,,
Begin to think of yourself as beocming the person you want to be,,,,,,,,,,,,,,
Illusions commend themselves to us because they save us pain and allow us to enjoy pleasure instead. We must therefore accept it without complaint when they sometimes wollide with a bit of reality against which they are dashed to pieces,,,,,,,,,,,,,,
"Until you value yourself, you won't value your time. Until you valule your time, you will not do anything with it.",,,,,,,,,,,,,,
"The concept of faith encompasses more than a personal relationship with God. It is the existential acceptance of something transcending ordinary experience. Faith is not an opinion, but a state.",,,,,,,,,,,,,,
"The courageous person chooses to face the basic anxieties of living and, as a result of this act of courage, develops the capacity to live life unafraid",,,,,,,,,,,,,,
All I have seen teaches me to trust the creator for all I have not seen,,,,,,,,,,,,,,
Our nonverbals govern how we think and feel about ourselves,,,,,,,,,,,,,,
"In pursuit of knowledge, every day something is acquired;in pursuit of wisdom, every day something is dropped",,,,,,,,,,,,,,
We must know ourselves before we can truly love another person,,,,,,,,,,,,,,
Fake it till you become it,,,,,,,,,,,,,,
"When one door of happiness closes, another opens; but often we look so long at the closed door that we don't see the one which has been opened for us",,,,,,,,,,,,,,
There is an emotional subtext to every human interaction,,,,,,,,,,,,,,
"How to learn languages:Language content that is relevant to youCommunicate!Understand meaning, not wordsTolerate ambiguity",,,,,,,,,,,,,,
Short-term or long-term focus?,,,,,,,,,,,,,,
"I want to help and encourage people to be mindful, to be attentive to what they really want",,,,,,,,,,,,,,
Function determines form,,,,,,,,,,,,,,
"Gratitude makes sense of our past, brings peace for today, and creates a vision for tomorrow",,,,,,,,,,,,,,
Three o'clock is always too late ore too early for anything you want to do,,,,,,,,,,,,,,
An important function of emotions is to show that an event is personally relevant and that it needs further processing to adaptively respond to it,,,,,,,,,,,,,,
"In the future, instead of striving to be right at a high costs, it will be more appropriate to be flexible and plural at a lower cost. If you cannot predict the future, you must be flexibly prepared to deal with various possible futures",,,,,,,,,,,,,,
"Remember that what is insulting is not the person who abuses or hits you, but the judgement about them that they are insulting",,,,,,,,,,,,,,
Taking risks in order to learn and grow,,,,,,,,,,,,,,
"The choice of authenticity may generate a calm acceptance of the unknown, a general lack of anxiety and the continuing development of the capacity to live life less afraid",,,,,,,,,,,,,,
"When we are no longer able to change a situation, we are challenged to change ourselves",,,,,,,,,,,,,,
Life's battles don't always go to the one who is stronger or faster. Sooner or later the one who wins is the one who thinks they can,,,,,,,,,,,,,,
"The more you put yourself in uncomfortable situations, the less uncomfortable they become",,,,,,,,,,,,,,
Being totally certain of something allows us to keep our beliefs but we never gain new knowledge,,,,,,,,,,,,,,
"Among strangers, competition and isolation created eneomies. Among enemies, cooperation created friends",,,,,,,,,,,,,,
"It's impossible, said pride.It's risky, said experience.It's pointless, said reason.I'll just do it, is what I said.",,,,,,,,,,,,,,
"Being in the moment and breaking old ways of thinking, especially when it comes to other people, takes enourmous courage",,,,,,,,,,,,,,
Tough times never last but tough people do,,,,,,,,,,,,,,
"Sometimes you succeed, sometimes you learn",,,,,,,,,,,,,,
"There are two statements about humans that true: that all human beings are alike, and that all are different",,,,,,,,,,,,,,
Enjoy the journey rather than the destination,,,,,,,,,,,,,,
"If you want to go fast, go alone!If you want to go far, go together!And if you want both, pick the right people!",,,,,,,,,,,,,,
Courage is to tell the story of who you are with your whole heart; courage to be imperfect,,,,,,,,,,,,,,
"In NVC we don't try to be perfect because when we want to be perfect, we are so afraid that we don't even try",,,,,,,,,,,,,,
"If you ever feel compelled by cultural ""oughts"" or pushy prescriptions to move away from your values or beliefs, stand up for yourself!",,,,,,,,,,,,,,
"Es gibt kein Wissen, es gibt nur Verstehen",,,,,,,,,,,,,,
"It ain't about how hard you hit, it's about how hard you can get hit and keep moving forward",,,,,,,,,,,,,,
"Our longings and our worries are both to some degree overblown, because we have within us the capacity to manufacture the very commodity we are constantly chasing when we choose experience",,,,,,,,,,,,,,
Klarheit und Verständnis entlasten,,,,,,,,,,,,,,
"The wise learns from everything and everyone, the normal from experience, and the stupid knows everything better",,,,,,,,,,,,,,
"I suggest that each day we try to get rid of some of our own constraints. Because then we are happy about mistakes, we can learn from them",,,,,,,,,,,,,,
"We all want to be loved; when we're not being loved, we want to be admired. When we're not being admired, we want to be feared. When we're not being feared, we want to be hated and despised. We want to elicit a feeling in others, no matter which one this may be. Our sooul longs for contact!",,,,,,,,,,,,,,
Don't waste time being perfect and trying to succeed at all costs - learn instead,,,,,,,,,,,,,,
Our current education system forces you to choose between learning and success,,,,,,,,,,,,,,
"The ability to engage in introspection, I suggested, is the essential precondition for living the life of the mind, and the essential precondition for introspection is solitude",,,,,,,,,,,,,,
It's only when we let go of life and allow our innate wisdom to flourish that we live,,,,,,,,,,,,,,
We spend money we haven't earned on things we don't need to impress people we don't like,,,,,,,,,,,,,,
"Das Geheimnis der Veränderung: Fokussiere all deine Energie nicht auf das Bekämpfen des Alten, sondern auf die Erschaffung des Neuen",,,,,,,,,,,,,,
"The aim of an argument or discussion should not be victory, but progress",,,,,,,,,,,,,,
"Verurteile nie einen Menschen, bevor du nicht einen Mond lang in seinen Mokassins gegangen bist",,,,,,,,,,,,,,
Chaos is the origin of perfection,,,,,,,,,,,,,,
"Konzentration heißt wörtlich: Sammlung auf einen Mittelpunkt, Zusammenfassung, Vereinigung. Man versteht darunter die Fähigkeit, die Aufmerksamkeit willkürlich auf bestimmte Gedanken oder Objekte zu richten. Unwillkürliche Aufmerksamkeit nennt man Interesse",,,,,,,,,,,,,,
Think about your dreams as you would about a committed relationship. Your dreams are life partners—give up on them and you’re partly giving up on yourself.,,,,,,,,,,,,,,
"Process of framing as “selecting some aspects of a perceived reality and making them more salient in a communicating text""",,,,,,,,,,,,,,
Umwege erhöhen die Ortskenntnis,,,,,,,,,,,,,,
"For whom sufficient is too little, nothing will be sufficient. Epicurus",,,,,,,,,,,,,,
"Denkkraft entsteht erst, wenn die Gedanken gesammelt werden; wie einzelne Tropfen keine Macht haben, zu einem Strom gesammelt aber elek­trische Energie erzeugen und viele andere Arbeiten leisten können.",,,,,,,,,,,,,,
"Jeder Gedanke ist eine Äußerung der Seele jener „metaphysischen, wis­senschaftlich nicht analysierbaren Kraft, die nur an ihren schöpferischen Wirkaungen erkannt werden kann. Ehe wir überhaupt ein .. Ich“, ein Be­wußtsein haben, waltet in uns schon dieses bildende, weise leitende, for­mende, gestaltende Prinzip, das überall im Körper weiß und wirkt, was not tut - und zwar durch die ebenso segensreiche wie gefährliche Macht der Gedanken“.",,,,,,,,,,,,,,
"The best people possess a feeling for beauty, the courage to take risks, the discipline to tell the truth, the capacity for sacrifice. Ironically, their virtues make them vulnerable; they are often wounded, sometimes destroyed.",,,,,,,,,,,,,,
Es gibt keine Veränderung ohne vorhergehendes Verständnis,,,,,,,,,,,,,,
Ever tried. Ever failed. No matter. Try again. Fail again. Fail better.,,,,,,,,,,,,,,
Aus der Diagnose folgt die Therapie,,,,,,,,,,,,,,
"Krísis heißt im Altgriechischen »Urteil« oder »Entscheidung «. In seiner ursprünglichen Bedeutung ist krísis das »Stellhölzchen«. Nimmt man es heraus, verändert sich der weitere Prozess grundlegend. Man kann das Stellhölzchen nach rechts oder nach links einrasten lassen, und entsprechend fließt das Wasser in eine andere Richtung. Somit können gewaltige Veränderungen durch minimale Korrekturen an geeigneter Stelle erreicht.",,,,,,,,,,,,,,
"Im Kern des Humanismus steht die menschliche Fähigkeit, sich von Gründen affizieren zu lassen. Theoretischer (oder anthropologischer) Humanismus beruht auf dem Vertrauen in diese menschliche Fähigkeit, und der ethische Humanismus füllt dies mit dem Inhalt einer humanen Lebensform, gruppiert um die kanonische Trias von Vernunft, Freiheit und Verantwortung",,,,,,,,,,,,,,
"Erst ignorieren sie dich, dann lachen sie über dich, dann bekämpfen sie dich, und dann gewinnst du",,,,,,,,,,,,,,
"„Wenn Menschen etwas tun, was uns stört, dann möchten wir, dass sie ihr Verhalten ändern.Ihr Verhalten ändern, das können Menschen nur, wenn wir sie klar und direkt ansprechen.Ihr Verhalten ändern, das wollen Menschen nur, wenn wir wertschätzend mit ihnen umgehen.“",,,,,,,,,,,,,,
Zu Reform und Neustrukturierung gehört als allererstes das Verständnis des bereits Vorhandenen.,,,,,,,,,,,,,,
"Money is like gasoline during a roadtrip. You don't want to run out of gas on your trip, but you're not doing a tour of gas stations.",,,,,,,,,,,,,,
"Whenever you find yourself on the side of the majority, it is time to pause and reflect.",,,,,,,,,,,,,,
"Very often along the way, the answer has outgrown the question.",,,,,,,,,,,,,,
"We turn to history (or biography) and only to history of what we are seeking are the actual causes, sources, and conditions of overt change of patterns (and structures)",,,,,,,,,,,,,,
Die Zugänglichkeit zur Körpersprache ermöglicht erst die Zugänglichkeit zu dem Gesagten und den Argumenten,,,,,,,,,,,,,,
An autopoietic machine is a machine organized (defined as a unity) as a network of processes of production (transformation and destruction) of components which: (i) through their interactions and transformations continuously regenerate and realize the network of processes (relations) that produced them; and (ii) constitute it (the machine) as a concrete unity in space in which they (the components) exist by specifying the topological domain of its realization as such a network,,,,,,,,,,,,,,
"Analogical reasoning proceeds by assimilating the properties of one thing to those of another, rather than trying to grasp the former in themselves",,,,,,,,,,,,,,
Human beings have a habit of turning metaphor into geometry,,,,,,,,,,,,,,
"Letting the natural rhythm of the conversation dictate the length of the meeting, rather than let the length of the meeting dictate the rhythm of the conversation",,,,,,,,,,,,,,
"Chronos time is informed by the passing of seconds, whereas kairos time is informed by the emergence of meaning",,,,,,,,,,,,,,
"Leisure, not to be confused with idleness, is the ability to find time for meditation and contemplation",,,,,,,,,,,,,,
"Once upon a time great environmental diversity and peoples' adaptation to it created unevenness in human societal development.Then, great diversity in human greed, vanity and unscrupulousness maintained and exacerbated the drama.",,,,,,,,,,,,,,
"Complexity not as patternless jumble, but as inner differentiation of parts, across many dimensions, but within an ontological whole.",,,,,,,,,,,,,,
Mind is the thread connecting the present with the past.,,,,,,,,,,,,,,
Everything is both continuity and change. What is emphasized among the two depends on which perspective you take,,,,,,,,,,,,,,
Lived psychological experience is too complex for rational reductions,,,,,,,,,,,,,,
"Social relations help regulate emotions, both by producing some emotionsand by moderating emotions produced by other causes, and theyinfluence the impact of events on emotional well-being.",,,,,,,,,,,,,,
"Nur wer Angst hat vor dem Fall, muss ein ganzes Leben kriechen",,,,,,,,,,,,,,
"Genau genommen leben sehr wenige Menschen in der Gegenwart. Die meisten bereiten sich darauf vor, demnächst zu leben",,,,,,,,,,,,,,
Behavior is incredibly self-reinforcing by means of its interaction with the environment. A given behavior will lead one to a particular environment which in turn will reinforce the initial environment selection,,,,,,,,,,,,,,
The search for security transforms all human relations into relations of power and domination,,,,,,,,,,,,,,
"Progress, not perfection!",,,,,,,,,,,,,,
"Less optimizing, more doing. You can’t know the best possible future, if there be such a thing at all, you adapt more than you think, and you don’t want a predictable life, right?",,,,,,,,,,,,,,
You can’t be efficient unless you have aligned your objectives with your tools,,,,,,,,,,,,,,
"Every day should be a discovery, a look inside, see what’s up, with you and how you feel about the world",,,,,,,,,,,,,,
"Geld wird oft benutzt, um emotionale Konflikte auszutragen",,,,,,,,,,,,,,
Sometimes you have to cross the line just to remember where it lays,,,,,,,,,,,,,,
"Pass auf, dich nicht so zu zerdenken, dass du dich nicht mehr spürst",,,,,,,,,,,,,,
You don’t have to know the end at the beginning,,,,,,,,,,,,,,
When there is urgency there can rarely be order,,,,,,,,,,,,,,
The growth of knowledge depends entirely on the existence of disagreement,,,,,,,,,,,,,,
La simplicté est la sophistication ultime,,,,,,,,,,,,,,
Le voyage est un retour vers l’essentiel,,,,,,,,,,,,,,
"Zufriedenheit wächst in dem Maße, wie wir das leben, was wir wirklich wollen und nicht (all) das tun, was wir meinen tun zu sollen",,,,,,,,,,,,,,
Sei dir selbst dein bester Freund,,,,,,,,,,,,,,
"Goal pursuit means having a goal, assessing where one is with respect to it, and taking steps to reduce the sensed discrepancy",,,,,,,,,,,,,,
"First vision (leads to apsirations, wishes, self-actualization), then goal-orientation (leads to self-fulfilling prophecies, ambition, good plans, focus, discipline, ), then process-oriention to make progress (leads to gratefulness, self-efficacy, flexibility, development, change)",,,,,,,,,,,,,,
"Whisteling to keep up courage is no mere figure of speech. One the other hand, sit all day in a moping posture, sigh and reply to everything with a dismal voice and your melon colleague lingers",,,,,,,,,,,,,,
If we don’t want to change there is very often a perceived (sometimes subconscious) benefit to the old habit,,,,,,,,,,,,,,
Two types of beliefs fundamentally influence people’s vocational interests: self-efficacy beliefs and outcome expectancies,,,,,,,,,,,,,,
Formation of character is not achieved by consumption of knowledge but rather by the creation of value and virtue,,,,,,,,,,,,,,
"A variety of cognitive factors have been linked to well-being, factors that are presumably also amenable to some volitional control. These include pausing to count one’s blessings, eschewing social comparisons and contingent self-evaluations, and choosing to feel a sense of optimism or efficacyregarding one’s life.",,,,,,,,,,,,,,
"Depression als Resignation nach der Wut, es nicht geschafft zu haben, auf sich selbst zu achten und sich selbst zu pflegen",,,,,,,,,,,,,,
I don't want to die without any scars,,,,,,,,,,,,,,
Visualize yourself overcoming obstacles,,,,,,,,,,,,,,
"Empty your mind. Be formless, shapeless - like water. If you put it in a cup, it becomes the cup. If you put water in a bottle, it becomes the bottle. If you put it in a tea cup, it becomes the tea cup. Now, water can flow or it can crash.Be water, my friend.",,,,,,,,,,,,,,
Freedom discovers you the moment you lose concern over what impression you are making or about to make.,,,,,,,,,,,,,,
"Free yourself from styles, patterns or moulds. Seek freedom from the conformity of styles.",,,,,,,,,,,,,,
"He who wants to succeed should learn how to fight, to strive and to suffer. You can acquire a lot in life, if you are prepared to give up a lot to get it.",,,,,,,,,,,,,,
To hell with circumstances; I create opportunities,,,,,,,,,,,,,,
Using no way as way. Having no limitation as limitation.,,,,,,,,,,,,,,
"Not failure, but low aim, is the crime. In great attempts it is glorious even to fail",,,,,,,,,,,,,,
Don't misinterpret difficulties in working on a possible self as evidence that a goal is unrealistic!,,,,,,,,,,,,,,
"Autonomy and connection are not only non-exclusive, they actually are conditional on each other: I can't be autonomous if I can't be sure there will be connection again, and I can't genuinely connect if I don't do so out of my own decision and freedom",,,,,,,,,,,,,,
How systems handle overload: - disregarding (unimportant) input (e.g. ignore a sick drunk on street) - allot less time to each stimulus (e.g. spend less time with family) - share overload with an alternative system (e.g.shifting change making: require passengers to have exact bus fare) - block off certain stimuli before they can gain entry (e.g. projecting an unfriendly appearance in order to prevent any new contacts),,,,,,,,,,,,,,
"Ethics: The standards that govern the conduct of a person, especially a member of a profession",,,,,,,,,,,,,,
What is important to us dictates what we attend to!,,,,,,,,,,,,,,
"The quality of results does not depend on the elimination of uncertainty. Rather, the skilled management of uncertainty, along with the recognition of decision stakes, is the key to quality",,,,,,,,,,,,,,
"Beliefs in personal efficacy affect life choices, level of motivation, quality of functioning, resilience to adversity and vulnerability to stress and depression. People who regard themselves as highly efficacious act, think, and feel differently from those who perceive themselves as inefficacious. They produce their own future, rather than simply foretell it",,,,,,,,,,,,,,
When the expectations are fulfilled you never realize them. Only when they are not.,,,,,,,,,,,,,,
"Our possessions are not only a reflection of our identity, they are also a major contributor to it",,,,,,,,,,,,,,
"Jeremy's Definition von erfolgreichen Führungspersonen: Probleme schnell, präzise und multi-perspektiv einschätzen. Pragmatische Lösungen entwerfen und diese verständlich und politisch sinnvoll kommunizieren",,,,,,,,,,,,,,
Personal development is the cornerstone of being able to be of help to others,,,,,,,,,,,,,,
Mistakes are the engine of education,,,,,,,,,,,,,,
Leaving is just the precursor to arriving,,,,,,,,,,,,,,
There is a psychological link between our own self interest and the reality of another person's good or ill,,,,,,,,,,,,,,
Write down your life into 3-years parts: What did I do at that time? What did I learn? How did people remember me from that time?,,,,,,,,,,,,,,
Ethics is a code of values which guide our choices and actions and determines the purpose and course of our lives,,,,,,,,,,,,,,
"Our assumptions define and limit what we see, i.e., we tend to see things in such a way that they will fit in with our assumptions even if this involves distortions or omissions",,,,,,,,,,,,,,
Meanings are not grasped but originate and function internally in a social environment,,,,,,,,,,,,,,
"The individual in any really intelligible sense, does not exist apart from his relations with other individuals",,,,,,,,,,,,,,
"The concept of allostasis, maintaining stability through change, is a fundamental process through which organisms actively adjust to both predictable and unpredictable events",,,,,,,,,,,,,,
Honesty is the first chapter in the book of wisdom (Thomas Jefferson),,,,,,,,,,,,,,
"Many people think that there are two instances: the controller and the controlled. But biological systems aren't like that. The controller/controlled is always embedded in a system. One and the same mechanism can lead to different outcomes. A wheel on a robot may always simply roll, but the different material/surface etc. lead to different behaviors/outcomes",,,,,,,,,,,,,,
"Successful psychological functioning: a) self-acceptance: feeling good about oneself and about one's past life b) positive relations with others: having high-quality, caring relationships with others c) environmental mastery: being able to create an environment in which one can function successfully d) autonomy: having the capacity to think and act on one's own, when appropriate e) purpose in life: having substantial reasons for living f) personal growth: continuing to strive for personal improvement and development",,,,,,,,,,,,,,
"Even the humblest person, who sets before his	fellows an example of industry, sobriety, and upright honesty of purpose in life, has a present as well as a future influence upon the well-being of his country; for his character and life pass unconsciously into the lives of others, and propagate good example for all time to come.",,,,,,,,,,,,,,
Power is in combination,,,,,,,,,,,,,,
Why it is so incredibly important to be an effective learner. As opposed to thinking that after some time I have achieved the expertise to not have to be a learner anymore. Reason: in today's world you will have to work inter-disciplinary and thus you will always be a noob in a new field. Being a minority for a while!,,,,,,,,,,,,,,
"Journalist to Thomas Eddison: Mr. Eddison you have failed 5000 times to invent the light bulb. Give up!? Eddison: Excuse me? I haven't failed 5000 times, I have succeeded 5000 times in showin ways that don't work. I have failed my way to success",,,,,,,,,,,,,,
If you always do what you always did – you will always get what you always got,,,,,,,,,,,,,,
Science is a pragmatic exploratory coping with the world,,,,,,,,,,,,,,
Feeling is meaning,,,,,,,,,,,,,,
"I’ve learned about the cycle that sometimes I will feel those recognizable symptoms: the sense that I’ve hollowed out, retreated a bit too deeply into my mind, forgetful of the happiness I’ve known and worrisome that I won’t feel it again. But I’ve also learned to trust the other swing of the cycle, even when it seems furthest away: that I will come back out, that I’m never too far gone, that I’ll resist the fall into emptiness, and I’ll turn off the episode of whatever show I’m binge-watching, and get dressed, and rejoin the world",,,,,,,,,,,,,,
"Starting over isn’t about changing your scene, but the way you’re living in it. It’s about opening your eyes again, walking to the ledge and looking up, down and across, once again comprehending the vastness of life that sits openly waiting for you.",,,,,,,,,,,,,,
To address today's world complexities: 1) Live a sensual life. 2) Be curious. 3) Be open. 4) Allow your mind to make metaphor. 5) Address the paradox in integrative ways not in either-or ways,,,,,,,,,,,,,,
Constantly ask yourself: what is the meta-narrative of all this?,,,,,,,,,,,,,,
